Index,sentiment,binary_value,sentiment:confidence,text,tokens ,Column12
n2920,3,1,0.7726,"  iphone 6 the next iphone will be out in 6 months making the the case 1,mm thicker would make sturdier and lens flush","[\'iphone\', \'6\', \'the\', \'next\', \'iphone\', \'will\', \'be\', \'out\', \'in\', \'6\', \'months\', \'making\', \'the\', \'the\', \'case\', \'1\', \'mm\', \'thicker\', \'would\', \'make\', \'sturdier\', \'and\', \'lens\', \'flush\'] ",
n2921,5,1,1,take the stress out of looking for christmas presents  amp  get a 15  student discount at   ,"[\'take\', \'the\', \'stress\', \'out\', \'of\', \'looking\', \'for\', \'christmas\', \'presents\', \'amp\', \'get\', \'a\', \'15\', \'student\', \'discount\', \'at\'] ",
n2922,3,1,0.7481,apple   115 matches 8 4  increase in earnings  use 2014q3 eps  1 42 on your  iphone   aapl \n,"[\'apple\', \'115\', \'matches\', \'8\', \'4\', \'increase\', \'in\', \'earnings\', \'use\', \'2014q3\', \'eps\', \'1\', \'42\', \'on\', \'your\', \'iphone\', \'aapl\'] ",
n2923,3,1,0.7079,apples best of the itunes store 2014  elevate and pixelmator win top app honors   aapl,"[\'apples\', \'best\', \'of\', \'the\', \'itunes\', \'store\', \'2014\', \'elevate\', \'and\', \'pixelmator\', \'win\', \'top\', \'app\', \'honors\', \'aapl\'] ",
n2924,3,1,0.6595,apple could release 4 inch iphone 6 mini next year  aapl  aapl \n,"[\'apple\', \'could\', \'release\', \'4\', \'inch\', \'iphone\', \'6\', \'mini\', \'next\', \'year\', \'aapl\', \'aapl\'] ",
n2925,3,1,1," will the  iphone6plus shortage hurt    apple  this christmas?  ( monday, 8  december) ","[\'will\', \'the\', \'iphone6plus\', \'shortage\', \'hurt\', \'apple\', \'this\', \'christmas\', \'monday\', \'8\', \'december\'] ",
n2926,1,0,0.7079," 18  million iphone users have never bonked to    apple pay  ( monday, 8  december) ","[\'18\', \'million\', \'iphone\', \'users\', \'have\', \'never\', \'bonked\', \'to\', \'apple\', \'pay\', \'monday\', \'8\', \'december\'] ",
n2927,1,0,0.6873,  it stopped working? i would be screaming  im getting mine 12 24 ,"[\'it\', \'stopped\', \'working\', \'i\', \'would\', \'be\', \'screaming\', \'im\', \'getting\', \'mine\', \'12\', \'24\'] ",
n2928,3,1,1, follow  ,[\'follow\'] ,
n2929,3,1,0.6792,my ear deleted whats app during a phone call  ,"[\'my\', \'ear\', \'deleted\', \'whats\', \'app\', \'during\', \'a\', \'phone\', \'call\'] ",
n2930,3,1,1,will apple inc s profit margin continue upward?  aapl  aapl \n,"[\'will\', \'apple\', \'inc\', \'s\', \'profit\', \'margin\', \'continue\', \'upward\', \'aapl\', \'aapl\'] ",
n2931,1,0,0.6631, aapl apple exec gets a federal prison sentence for taking kickbacks on leak   ,"[\'aapl\', \'apple\', \'exec\', \'gets\', \'a\', \'federal\', \'prison\', \'sentence\', \'for\', \'taking\', \'kickbacks\', \'on\', \'leak\'] ",
n2932,3,1,1," will    apple  head back to  jobs ideology with 4in  iphone6s?  ( monday, 8  december) ","[\'will\', \'apple\', \'head\', \'back\', \'to\', \'jobs\', \'ideology\', \'with\', \'4in\', \'iphone6s\', \'monday\', \'8\', \'december\'] ",
n2933,1,0,1,all they do is steal your money   ),"[\'all\', \'they\', \'do\', \'is\', \'steal\', \'your\', \'money\'] ",
n2934,1,0,0.6894,apple doesnt need no stinking streaming media stick!  aapl  aapl \n,"[\'apple\', \'doesnt\', \'need\', \'no\', \'stinking\', \'streaming\', \'media\', \'stick\', \'aapl\', \'aapl\'] ",
n2935,3,1,1," aapl update 1 taiwan nov export growth tops expectations, despite china wea   ","[\'aapl\', \'update\', \'1\', \'taiwan\', \'nov\', \'export\', \'growth\', \'tops\', \'expectations\', \'despite\', \'china\', \'wea\'] ",
n2936,1,0,0.6759, i give up  you beat me  trying to manually add music to my iphone has left me a broken man   itunes  apple,"[\'i\', \'give\', \'up\', \'you\', \'beat\', \'me\', \'trying\', \'to\', \'manually\', \'add\', \'music\', \'to\', \'my\', \'iphone\', \'has\', \'left\', \'me\', \'a\', \'broken\', \'man\', \'itunes\', \'apple\'] ",
n2937,1,0,1, my app store aint working  y??,"[\'my\', \'app\', \'store\', \'aint\', \'working\', \'y\'] ",
n2938,3,1,0.7658,  is that a chic filet mug hes holding? my daughter brought on these characters home that talks   absolutely hilarious ,"[\'is\', \'that\', \'a\', \'chic\', \'filet\', \'mug\', \'hes\', \'holding\', \'my\', \'daughter\', \'brought\', \'on\', \'these\', \'characters\', \'home\', \'that\', \'talks\', \'absolutely\', \'hilarious\'] ",
n2939,3,1,0.6635,lesson  dont fuck with  apple exec has been given a year in prison for leaking information to asian suppliers ,"[\'lesson\', \'dont\', \'fuck\', \'with\', \'apple\', \'exec\', \'has\', \'been\', \'given\', \'a\', \'year\', \'in\', \'prison\', \'for\', \'leaking\', \'information\', \'to\', \'asian\', \'suppliers\'] ",
n2940,3,1,1," alle  news zu  iphone,  ipod und    apple  watch  ( monday, 8  december) ","[\'alle\', \'news\', \'zu\', \'iphone\', \'ipod\', \'und\', \'apple\', \'watch\', \'monday\', \'8\', \'december\'] ",
n2941,1,0,1, ur products are shit they break 24 7 ur ruining my life,"[\'ur\', \'products\', \'are\', \'shit\', \'they\', \'break\', \'24\', \'7\', \'ur\', \'ruining\', \'my\', \'life\'] ",
n2942,3,1,0.6722,  what happened omd,"[\'what\', \'happened\', \'omd\'] ",
n2943,1,0,1,  one of you stepped on my phone last night and its smashed and doesnt work  ),"[\'one\', \'of\', \'you\', \'stepped\', \'on\', \'my\', \'phone\', \'last\', \'night\', \'and\', \'its\', \'smashed\', \'and\', \'doesnt\', \'work\'] ",
n2944,1,0,0.6616,  what the fuck show me,"[\'what\', \'the\', \'fuck\', \'show\', \'me\'] ",
n2945,3,1,1,dan nathan  how to profit from apple stock?  \n aapl  aapl \n,"[\'dan\', \'nathan\', \'how\', \'to\', \'profit\', \'from\', \'apple\', \'stock\', \'aapl\', \'aapl\'] ",
n2946,3,1,1, id like to see emojis that look like me,"[\'id\', \'like\', \'to\', \'see\', \'emojis\', \'that\', \'look\', \'like\', \'me\'] ",
n2947,1,0,1,"former apple inc  supply manager sentenced to prison, fined  4 5 million for corporate espionage   aapl  aapl \n","[\'former\', \'apple\', \'inc\', \'supply\', \'manager\', \'sentenced\', \'to\', \'prison\', \'fined\', \'4\', \'5\', \'million\', \'for\', \'corporate\', \'espionage\', \'aapl\', \'aapl\'] ",
n2948,1,0,0.6661,ahhhh!! y el  store of course!!!! ,"[\'ahhhh\', \'y\', \'el\', \'store\', \'of\', \'course\'] ",
n2949,3,1,0.6774,apple price target raised at bmo capital  sees unfulfilled iphone 6 demand pushed into march quarter  aapl  aapl \n,"[\'apple\', \'price\', \'target\', \'raised\', \'at\', \'bmo\', \'capital\', \'sees\', \'unfulfilled\', \'iphone\', \'6\', \'demand\', \'pushed\', \'into\', \'march\', \'quarter\', \'aapl\', \'aapl\'] ",
n2950,5,1,0.8119,"hope  store arndale could pass on to the staff member staff thats visually impaired she is an inspiration, great work  inawe  welldone","[\'hope\', \'store\', \'arndale\', \'could\', \'pass\', \'on\', \'to\', \'the\', \'staff\', \'member\', \'staff\', \'thats\', \'visually\', \'impaired\', \'she\', \'is\', \'an\', \'inspiration\', \'great\', \'work\', \'inawe\', \'welldone\'] ",
n2951,5,1,0.6904,"apple stock in upward trend after explosive holiday quarter, apple watch release in 2015  aapl  aapl \n","[\'apple\', \'stock\', \'in\', \'upward\', \'trend\', \'after\', \'explosive\', \'holiday\', \'quarter\', \'apple\', \'watch\', \'release\', \'in\', \'2015\', \'aapl\', \'aapl\'] ",
n2952,3,1,0.6822,doh! turns out the ipod at the heart of the  350m  antitrust case is the wrong model ,"[\'doh\', \'turns\', \'out\', \'the\', \'ipod\', \'at\', \'the\', \'heart\', \'of\', \'the\', \'350m\', \'antitrust\', \'case\', \'is\', \'the\', \'wrong\', \'model\'] ",
n2953,3,1,0.6722,doh! turns out the ipod at the heart of the  350m  antitrust case is the wrong model ,"[\'doh\', \'turns\', \'out\', \'the\', \'ipod\', \'at\', \'the\', \'heart\', \'of\', \'the\', \'350m\', \'antitrust\', \'case\', \'is\', \'the\', \'wrong\', \'model\'] ",
n2954,3,1,1,apple  facing a challenge from googles android  aapl  aapl \n,"[\'apple\', \'facing\', \'a\', \'challenge\', \'from\', \'googles\', \'android\', \'aapl\', \'aapl\'] ",
n2955,1,0,1,help? 4s wont sync (doesnt even give option) w  latest  tried fixes i found    no bueno  thoughts?   techsupport,"[\'help\', \'4s\', \'wont\', \'sync\', \'doesnt\', \'even\', \'give\', \'option\', \'w\', \'latest\', \'tried\', \'fixes\', \'i\', \'found\', \'no\', \'bueno\', \'thoughts\', \'techsupport\'] ",
n2956,5,1,0.7467,apples iphone 6 lead times still longer than previous models   aapl  aapl \n,"[\'apples\', \'iphone\', \'6\', \'lead\', \'times\', \'still\', \'longer\', \'than\', \'previous\', \'models\', \'aapl\', \'aapl\'] ",
n2957,3,1,1, lawsuit could collapse as new  evidence comes to fore ,"[\'lawsuit\', \'could\', \'collapse\', \'as\', \'new\', \'evidence\', \'comes\', \'to\', \'fore\'] ",
n2958,3,1,0.6544,will the iphone 6 plus shortage hurt apple this christmas?   aapl  aapl \n,"[\'will\', \'the\', \'iphone\', \'6\', \'plus\', \'shortage\', \'hurt\', \'apple\', \'this\', \'christmas\', \'aapl\', \'aapl\'] ",
n2959,3,1,1,"so, which  promoproduct suppliers carry brandable  compliant adapters?  headsaregoingtoroll  mfi","[\'so\', \'which\', \'promoproduct\', \'suppliers\', \'carry\', \'brandable\', \'compliant\', \'adapters\', \'headsaregoingtoroll\', \'mfi\'] ",
n2960,3,1,0.7595,apple may be forced to re think ipod touch as demand surges   aapl  aapl \n,"[\'apple\', \'may\', \'be\', \'forced\', \'to\', \'re\', \'think\', \'ipod\', \'touch\', \'as\', \'demand\', \'surges\', \'aapl\', \'aapl\'] ",
n2961,1,0,1,former apple inc  exec gets a year in prison for selling secrets   aapl,"[\'former\', \'apple\', \'inc\', \'exec\', \'gets\', \'a\', \'year\', \'in\', \'prison\', \'for\', \'selling\', \'secrets\', \'aapl\'] ",
n2962,1,0,1, well done you  cunts my printer dont work since your  fucking  yosemite  update  pricks!,"[\'well\', \'done\', \'you\', \'cunts\', \'my\', \'printer\', \'dont\', \'work\', \'since\', \'your\', \'fucking\', \'yosemite\', \'update\', \'pricks\'] ",
n2963,3,1,1,"rt  so, which  promoproduct suppliers carry brandable  compliant adapters?  headsaregoingtoroll  mfi","[\'rt\', \'so\', \'which\', \'promoproduct\', \'suppliers\', \'carry\', \'brandable\', \'compliant\', \'adapters\', \'headsaregoingtoroll\', \'mfi\'] ",
n2964,3,1,1, retail locations to offer free coding workshops dec 11th as part of the hour of code ,"[\'retail\', \'locations\', \'to\', \'offer\', \'free\', \'coding\', \'workshops\', \'dec\', \'11th\', \'as\', \'part\', \'of\', \'the\', \'hour\', \'of\', \'code\'] ",
n2965,3,1,1,apple intraday comments   pre opening   premium users   aapl  stockaction  trading  stocks  mkt \n,"[\'apple\', \'intraday\', \'comments\', \'pre\', \'opening\', \'premium\', \'users\', \'aapl\', \'stockaction\', \'trading\', \'stocks\', \'mkt\'] ",
n2966,1,0,0.6624,"rt  studio at 45,000 ft   one outlet,  4 computers    we need the batteries of the future now!!!! ","[\'rt\', \'studio\', \'at\', \'45\', \'000\', \'ft\', \'one\', \'outlet\', \'4\', \'computers\', \'we\', \'need\', \'the\', \'batteries\', \'of\', \'the\', \'future\', \'now\'] ",
n2967,3,1,0.6725,"after  china,  russia may ban some  products, fearing  espionage   \n \n ","[\'after\', \'china\', \'russia\', \'may\', \'ban\', \'some\', \'products\', \'fearing\', \'espionage\'] ",
n2968,3,1,1,must read  apples iphone 6 china unicom lead times  aapl  aapl \n,"[\'must\', \'read\', \'apples\', \'iphone\', \'6\', \'china\', \'unicom\', \'lead\', \'times\', \'aapl\', \'aapl\'] ",
n2969,3,1,0.6534,"rt  after  china,  russia may ban some  products, fearing  espionage   \n \n ","[\'rt\', \'after\', \'china\', \'russia\', \'may\', \'ban\', \'some\', \'products\', \'fearing\', \'espionage\'] ",
n2970,3,1,0.6833,"trade  aapl  free nightly updates are  posted here on  twitter, or you can visit the  trade  aapl free  website here ","[\'trade\', \'aapl\', \'free\', \'nightly\', \'updates\', \'are\', \'posted\', \'here\', \'on\', \'twitter\', \'or\', \'you\', \'can\', \'visit\', \'the\', \'trade\', \'aapl\', \'free\', \'website\', \'here\'] ",
n2972,3,1,0.658,   minneapolis isnt cupertino  when siri tells me its 36   in december no need to add the brr! f yeah might be more appropriate ,"[\'minneapolis\', \'isnt\', \'cupertino\', \'when\', \'siri\', \'tells\', \'me\', \'its\', \'36\', \'in\', \'december\', \'no\', \'need\', \'to\', \'add\', \'the\', \'brr\', \'f\', \'yeah\', \'might\', \'be\', \'more\', \'appropriate\'] ",
n2973,3,1,0.681,  is the iphone 6 y3k compliant?,"[\'is\', \'the\', \'iphone\', \'6\', \'y3k\', \'compliant\'] ",
n2974,3,1,1," aapl might invest in  tsla to increase r amp d plus increase production multi folds in ev cars, suv,s  by 2015 most of us  amp  china supercharged ","[\'aapl\', \'might\', \'invest\', \'in\', \'tsla\', \'to\', \'increase\', \'r\', \'amp\', \'d\', \'plus\', \'increase\', \'production\', \'multi\', \'folds\', \'in\', \'ev\', \'cars\', \'suv\', \'s\', \'by\', \'2015\', \'most\', \'of\', \'us\', \'amp\', \'china\', \'supercharged\'] ",
n2975,3,1,1,the power of  s strong branding and store design in one photo  via  ,"[\'the\', \'power\', \'of\', \'s\', \'strong\', \'branding\', \'and\', \'store\', \'design\', \'in\', \'one\', \'photo\', \'via\'] ",
n2976,1,0,0.6398,guys my mac is flipping out! flashing folder with question mark at start up!?! what do i do??  help  apple  mac  macbook   computer,"[\'guys\', \'my\', \'mac\', \'is\', \'flipping\', \'out\', \'flashing\', \'folder\', \'with\', \'question\', \'mark\', \'at\', \'start\', \'up\', \'what\', \'do\', \'i\', \'do\', \'help\', \'apple\', \'mac\', \'macbook\', \'computer\'] ",
n2977,5,1,0.6825,  ordering a laptop today  how about i try  or  instead  maybe their reps will be kind instead of this behavior ,"[\'ordering\', \'a\', \'laptop\', \'today\', \'how\', \'about\', \'i\', \'try\', \'or\', \'instead\', \'maybe\', \'their\', \'reps\', \'will\', \'be\', \'kind\', \'instead\', \'of\', \'this\', \'behavior\'] ",
n2978,3,1,1,apples pt raised by citigroup inc  to  135 00    aapl  aapl,"[\'apples\', \'pt\', \'raised\', \'by\', \'citigroup\', \'inc\', \'to\', \'135\', \'00\', \'aapl\', \'aapl\'] ",
n2979,3,1,0.6659,apples pt raised by citigroup inc  to  135 00    aapl  aapl,"[\'apples\', \'pt\', \'raised\', \'by\', \'citigroup\', \'inc\', \'to\', \'135\', \'00\', \'aapl\', \'aapl\'] ",
n2980,3,1,0.7403,"need to lock down a  sponsorship deal with  ,   amp    \n \nthank you for your cooperation    \nregards,  \nuncle mike","[\'need\', \'to\', \'lock\', \'down\', \'a\', \'sponsorship\', \'deal\', \'with\', \'amp\', \'thank\', \'you\', \'for\', \'your\', \'cooperation\', \'regards\', \'uncle\', \'mike\'] ",
n2981,5,1,1, thank you ,"[\'thank\', \'you\'] ",
n2982,3,1,1,"rt  after  china,  russia may ban some  products, fearing  espionage   \n \n ","[\'rt\', \'after\', \'china\', \'russia\', \'may\', \'ban\', \'some\', \'products\', \'fearing\', \'espionage\'] ",
n2983,3,1,0.7753,apple   fibonacci technicals levels   intraday   pre opening  aapl  aapl  \n,"[\'apple\', \'fibonacci\', \'technicals\', \'levels\', \'intraday\', \'pre\', \'opening\', \'aapl\', \'aapl\'] ",
n2984,3,1,0.7436,  shares a slice with  iphone6 lovers  ,"[\'shares\', \'a\', \'slice\', \'with\', \'iphone6\', \'lovers\'] ",
n2985,3,1,1, stevejobs predicted the future of  ecommerce back in 1996 and got it exactly right  aapl ,"[\'stevejobs\', \'predicted\', \'the\', \'future\', \'of\', \'ecommerce\', \'back\', \'in\', \'1996\', \'and\', \'got\', \'it\', \'exactly\', \'right\', \'aapl\'] ",
n2986,3,1,1,apple inc  vs google inc  the battle of the tech giants  aapl  aapl \n,"[\'apple\', \'inc\', \'vs\', \'google\', \'inc\', \'the\', \'battle\', \'of\', \'the\', \'tech\', \'giants\', \'aapl\', \'aapl\'] ",
n2987,3,1,1,here is the new  ad  aapl  ,"[\'here\', \'is\', \'the\', \'new\', \'ad\', \'aapl\'] ",
n2989,1,0,0.6755,woah  woke up to 20   emails of someone trying to verify that email for their device  my email minus   (which makes no diff on gmail),"[\'woah\', \'woke\', \'up\', \'to\', \'20\', \'emails\', \'of\', \'someone\', \'trying\', \'to\', \'verify\', \'that\', \'email\', \'for\', \'their\', \'device\', \'my\', \'email\', \'minus\', \'which\', \'makes\', \'no\', \'diff\', \'on\', \'gmail\'] ",
n2990,5,1,0.738,takes more than  marketing to convert shoppers to buyers    amp   create a total sense experience  ,"[\'takes\', \'more\', \'than\', \'marketing\', \'to\', \'convert\', \'shoppers\', \'to\', \'buyers\', \'amp\', \'create\', \'a\', \'total\', \'sense\', \'experience\'] ",
n2991,1,0,0.3343," aapl slide, opens opportunity  cant fill iphone 6 or 6plus orders, 6plus rumored to be much much higher   than prev reported ","[\'aapl\', \'slide\', \'opens\', \'opportunity\', \'cant\', \'fill\', \'iphone\', \'6\', \'or\', \'6plus\', \'orders\', \'6plus\', \'rumored\', \'to\', \'be\', \'much\', \'much\', \'higher\', \'than\', \'prev\', \'reported\'] ",
n2992,3,1,1,apple ceo tim cook comes out as gay      via ,"[\'apple\', \'ceo\', \'tim\', \'cook\', \'comes\', \'out\', \'as\', \'gay\', \'via\'] ",
n2993,3,1,0.7119,apple   fibonacci technicals levels   intraday  update    aapl  aapl  \n,"[\'apple\', \'fibonacci\', \'technicals\', \'levels\', \'intraday\', \'update\', \'aapl\', \'aapl\'] ",
n2994,3,1,1, iphone6  plus captures 41  of us  phablet sales  aapl ,"[\'iphone6\', \'plus\', \'captures\', \'41\', \'of\', \'us\', \'phablet\', \'sales\', \'aapl\'] ",
n2996,5,1,0.4975,bruh  real niggas need that 128gb ipod touch already,"[\'bruh\', \'real\', \'niggas\', \'need\', \'that\', \'128gb\', \'ipod\', \'touch\', \'already\'] ",
n2997,3,1,1,apple intraday comments   updated range    premium users   aapl  stockaction  trading  stocks  mkt \n,"[\'apple\', \'intraday\', \'comments\', \'updated\', \'range\', \'premium\', \'users\', \'aapl\', \'stockaction\', \'trading\', \'stocks\', \'mkt\'] ",
n2998,3,1,1,apple continues beefing up digital audio expertise by hiring dana massie from audience   aapl,"[\'apple\', \'continues\', \'beefing\', \'up\', \'digital\', \'audio\', \'expertise\', \'by\', \'hiring\', \'dana\', \'massie\', \'from\', \'audience\', \'aapl\'] ",
n2999,3,1,1, aapl one of apples earliest employees describes the first time steve jobs    ,"[\'aapl\', \'one\', \'of\', \'apples\', \'earliest\', \'employees\', \'describes\', \'the\', \'first\', \'time\', \'steve\', \'jobs\'] ",
n3000,3,1,0.7253,apple   115 matches 8 4  increase in earnings  2014q3 eps  1 42 in   ios app donkey stocks on your  iphone   aapl \n,"[\'apple\', \'115\', \'matches\', \'8\', \'4\', \'increase\', \'in\', \'earnings\', \'2014q3\', \'eps\', \'1\', \'42\', \'in\', \'ios\', \'app\', \'donkey\', \'stocks\', \'on\', \'your\', \'iphone\', \'aapl\'] ",
n3001,1,0,1,my phone keeps restarting on its own  dont play me like that???,"[\'my\', \'phone\', \'keeps\', \'restarting\', \'on\', \'its\', \'own\', \'dont\', \'play\', \'me\', \'like\', \'that\'] ",
n3002,3,1,1,rt  apples pt raised by citigroup inc  to  135 00    aapl  aapl,"[\'rt\', \'apples\', \'pt\', \'raised\', \'by\', \'citigroup\', \'inc\', \'to\', \'135\', \'00\', \'aapl\', \'aapl\'] ",
n3003,1,0,0.7416,"rt  after  china,  russia may ban some  products, fearing  espionage   \n \n ","[\'rt\', \'after\', \'china\', \'russia\', \'may\', \'ban\', \'some\', \'products\', \'fearing\', \'espionage\'] ",
n3004,5,1,0.6668,why the ipad is anything but doomed  aapl  aapl \n,"[\'why\', \'the\', \'ipad\', \'is\', \'anything\', \'but\', \'doomed\', \'aapl\', \'aapl\'] ",
n3005,1,0,0.3464,"reminiscing on the first low cost computer which, out of the box, you didnt have to be a geek to use   ","[\'reminiscing\', \'on\', \'the\', \'first\', \'low\', \'cost\', \'computer\', \'which\', \'out\', \'of\', \'the\', \'box\', \'you\', \'didnt\', \'have\', \'to\', \'be\', \'a\', \'geek\', \'to\', \'use\'] ",
n3006,1,0,1,last night i had like 10 more apps than i do now  whats up with that   i hate you,"[\'last\', \'night\', \'i\', \'had\', \'like\', \'10\', \'more\', \'apps\', \'than\', \'i\', \'do\', \'now\', \'whats\', \'up\', \'with\', \'that\', \'i\', \'hate\', \'you\'] ",
n3008,3,1,1,"   apple   is developing an  iphone that fires laser beams to  map surroundings      ( monday, 8  december) ","[\'apple\', \'is\', \'developing\', \'an\', \'iphone\', \'that\', \'fires\', \'laser\', \'beams\', \'to\', \'map\', \'surroundings\', \'monday\', \'8\', \'december\'] ",
n3009,3,1,1,apple intraday comments   updated range    premium users   aapl  stockaction  trading  stocks  mkt \n,"[\'apple\', \'intraday\', \'comments\', \'updated\', \'range\', \'premium\', \'users\', \'aapl\', \'stockaction\', \'trading\', \'stocks\', \'mkt\'] ",
n3010,3,1,1,headed to  and  store today  yikes or yay?  dayoffduties,"[\'headed\', \'to\', \'and\', \'store\', \'today\', \'yikes\', \'or\', \'yay\', \'dayoffduties\'] ",
n3011,3,1,0.7411, tell  to update their events page  theres no listing for your presentation ,"[\'tell\', \'to\', \'update\', \'their\', \'events\', \'page\', \'theres\', \'no\', \'listing\', \'for\', \'your\', \'presentation\'] ",
n3012,3,1,1,apple   fibonacci technicals levels   intraday  update    aapl  aapl  \n,"[\'apple\', \'fibonacci\', \'technicals\', \'levels\', \'intraday\', \'update\', \'aapl\', \'aapl\'] ",
n3013,3,1,1, edgf14 jane horvath (director of global  privacy  is speaking,"[\'edgf14\', \'jane\', \'horvath\', \'director\', \'of\', \'global\', \'privacy\', \'is\', \'speaking\'] ",
n3014,3,1,0.5098,"former apple manager sentenced to one year in prison,  4 5 million fine in leaked secrets case  mac blog    aapl","[\'former\', \'apple\', \'manager\', \'sentenced\', \'to\', \'one\', \'year\', \'in\', \'prison\', \'4\', \'5\', \'million\', \'fine\', \'in\', \'leaked\', \'secrets\', \'case\', \'mac\', \'blog\', \'aapl\'] ",
n3015,1,0,1,im so pissed i plugged my phone in overnight but it didnt charge fuck u ,"[\'im\', \'so\', \'pissed\', \'i\', \'plugged\', \'my\', \'phone\', \'in\', \'overnight\', \'but\', \'it\', \'didnt\', \'charge\', \'fuck\', \'u\'] ",
n3016,3,1,0.4962," siri was wildin last night, yall need to get her ","[\'siri\', \'was\', \'wildin\', \'last\', \'night\', \'yall\', \'need\', \'to\', \'get\', \'her\'] ",
n3017,3,1,0.6635,iphone 6 and 6 plus sales are growing steadily worldwide  aapl  aapl \n,"[\'iphone\', \'6\', \'and\', \'6\', \'plus\', \'sales\', \'are\', \'growing\', \'steadily\', \'worldwide\', \'aapl\', \'aapl\'] ",
n3018,1,0,1,  yknow that time it restarted and then my phone got blue screen lol wtf,"[\'yknow\', \'that\', \'time\', \'it\', \'restarted\', \'and\', \'then\', \'my\', \'phone\', \'got\', \'blue\', \'screen\', \'lol\', \'wtf\'] ",
n3019,1,0,0.741,why does  yosemite constantly restart due to an error when left over night?  onlyme ,"[\'why\', \'does\', \'yosemite\', \'constantly\', \'restart\', \'due\', \'to\', \'an\', \'error\', \'when\', \'left\', \'over\', \'night\', \'onlyme\'] ",
n3020,1,0,0.7651,bloombergtv   former  apple exec sentence to 1 year in prison for fraud   aapl,"[\'bloombergtv\', \'former\', \'apple\', \'exec\', \'sentence\', \'to\', \'1\', \'year\', \'in\', \'prison\', \'for\', \'fraud\', \'aapl\'] ",
n3021,1,0,1,there is nothing in life more fragile than an apple branded lightning cord  ,"[\'there\', \'is\', \'nothing\', \'in\', \'life\', \'more\', \'fragile\', \'than\', \'an\', \'apple\', \'branded\', \'lightning\', \'cord\'] ",
n3022,3,1,0.6495,what has  done now? rt  ,"[\'what\', \'has\', \'done\', \'now\', \'rt\'] ",
n3023,3,1,0.6826,purchase a  99  tv ( 99 value) simply by watching ads on  check out  vidfallauction here ,"[\'purchase\', \'a\', \'99\', \'tv\', \'99\', \'value\', \'simply\', \'by\', \'watching\', \'ads\', \'on\', \'check\', \'out\', \'vidfallauction\', \'here\'] ",
n3024,3,1,0.6672,consumers demand more units of the iphone 6 and 6 plus  aapl  aapl \n,"[\'consumers\', \'demand\', \'more\', \'units\', \'of\', \'the\', \'iphone\', \'6\', \'and\', \'6\', \'plus\', \'aapl\', \'aapl\'] ",
n3025,1,0,1,wtf is my conputer doing i left it alone for five minutes and it does this?? help   ,"[\'wtf\', \'is\', \'my\', \'conputer\', \'doing\', \'i\', \'left\', \'it\', \'alone\', \'for\', \'five\', \'minutes\', \'and\', \'it\', \'does\', \'this\', \'help\'] ",
n3026,3,1,0.7201,   the void awakens,"[\'the\', \'void\', \'awakens\'] ",
n3027,1,0,1,shout out to  for making crappy iphone alarms that dont go off and make me late for my final  ,"[\'shout\', \'out\', \'to\', \'for\', \'making\', \'crappy\', \'iphone\', \'alarms\', \'that\', \'dont\', \'go\', \'off\', \'and\', \'make\', \'me\', \'late\', \'for\', \'my\', \'final\'] ",
n3028,3,1,1,how to  profit in  apple ( aapl)  options  trade  trading  finance  short  bet  hedge ,"[\'how\', \'to\', \'profit\', \'in\', \'apple\', \'aapl\', \'options\', \'trade\', \'trading\', \'finance\', \'short\', \'bet\', \'hedge\'] ",
n3029,3,1,0.7227,apple assigned aa  credit rating by morningstar   aapl  aapl \n,"[\'apple\', \'assigned\', \'aa\', \'credit\', \'rating\', \'by\', \'morningstar\', \'aapl\', \'aapl\'] ",
n3030,1,0,1,"updated to yosemite on two machines  both are now painfully slow  thanks, ","[\'updated\', \'to\', \'yosemite\', \'on\', \'two\', \'machines\', \'both\', \'are\', \'now\', \'painfully\', \'slow\', \'thanks\'] ",
n3031,1,0,1,"  you should tell testers that if using gmail on ios, your app wont work  doesnt tell testers at all ","[\'you\', \'should\', \'tell\', \'testers\', \'that\', \'if\', \'using\', \'gmail\', \'on\', \'ios\', \'your\', \'app\', \'wont\', \'work\', \'doesnt\', \'tell\', \'testers\', \'at\', \'all\'] ",
n3032,5,1,0.669,apple continues beefing up digital audio expertise by hiring dana massie from audience  aapl  aapl \n,"[\'apple\', \'continues\', \'beefing\', \'up\', \'digital\', \'audio\', \'expertise\', \'by\', \'hiring\', \'dana\', \'massie\', \'from\', \'audience\', \'aapl\', \'aapl\'] ",
