Index,sentiment,binary_value,sentiment:confidence,text,tokens ,Column12
n1031,3,1,1,feed my ego (futter mein ego) iphone 4 4s tough ca  computing  amp  communication  melasdesign    ,"[\'feed\', \'my\', \'ego\', \'futter\', \'mein\', \'ego\', \'iphone\', \'4\', \'4s\', \'tough\', \'ca\', \'computing\', \'amp\', \'communication\', \'melasdesign\'] ",
n1032,1,0,1,my laptop battery went straight from 60  to 3  ,"[\'my\', \'laptop\', \'battery\', \'went\', \'straight\', \'from\', \'60\', \'to\', \'3\'] ",
n1033,1,0,0.7044,"last yeari bought superman and superman returns from  now they arent available for me to stream, and  has no real answer ","[\'last\', \'yeari\', \'bought\', \'superman\', \'and\', \'superman\', \'returns\', \'from\', \'now\', \'they\', \'arent\', \'available\', \'for\', \'me\', \'to\', \'stream\', \'and\', \'has\', \'no\', \'real\', \'answer\'] ",
n1034,1,0,1,i will definitely think carefully in the future about buying something from  if  support cant even tell me whats going wrong ,"[\'i\', \'will\', \'definitely\', \'think\', \'carefully\', \'in\', \'the\', \'future\', \'about\', \'buying\', \'something\', \'from\', \'if\', \'support\', \'cant\', \'even\', \'tell\', \'me\', \'whats\', \'going\', \'wrong\'] ",
n1035,3,1,0.7653,rt    trumps  in streaming media sales  ,"[\'rt\', \'trumps\', \'in\', \'streaming\', \'media\', \'sales\'] ",
n1036,3,1,0.6442,iphone 6 and 6 plus shipping times improve to 3 to 5 days for many models   aapl,"[\'iphone\', \'6\', \'and\', \'6\', \'plus\', \'shipping\', \'times\', \'improve\', \'to\', \'3\', \'to\', \'5\', \'days\', \'for\', \'many\', \'models\', \'aapl\'] ",
n1037,3,1,1,heres  apples next great business  via   aapl,"[\'heres\', \'apples\', \'next\', \'great\', \'business\', \'via\', \'aapl\'] ",
n1038,3,1,0.7734,is  apple the most important stock on earth?   apple inc   aapl   seeking alpha ,"[\'is\', \'apple\', \'the\', \'most\', \'important\', \'stock\', \'on\', \'earth\', \'apple\', \'inc\', \'aapl\', \'seeking\', \'alpha\'] ",
n1039,3,1,0.697,aye shoot me a space grey 64gb iphone 6 right quick  ,"[\'aye\', \'shoot\', \'me\', \'a\', \'space\', \'grey\', \'64gb\', \'iphone\', \'6\', \'right\', \'quick\'] ",
n1040,3,1,1,rt  rt    where do  iphones come from? whats in your    rareearths ,"[\'rt\', \'rt\', \'where\', \'do\', \'iphones\', \'come\', \'from\', \'whats\', \'in\', \'your\', \'rareearths\'] ",
n1041,3,1,0.4298," aapl dexcom ceo terry gregg explains 50  ytd stock leap, plans for 2015   ","[\'aapl\', \'dexcom\', \'ceo\', \'terry\', \'gregg\', \'explains\', \'50\', \'ytd\', \'stock\', \'leap\', \'plans\', \'for\', \'2015\'] ",
n1042,3,1,0.6513, aapl heres apples next great business   ,"[\'aapl\', \'heres\', \'apples\', \'next\', \'great\', \'business\'] ",
n1043,3,1,1,is apple the most important stock on earth?   aapl,"[\'is\', \'apple\', \'the\', \'most\', \'important\', \'stock\', \'on\', \'earth\', \'aapl\'] ",
n1044,1,0,1,this 16gb is going to kill me  im this close to taking a shit on my phone  ,"[\'this\', \'16gb\', \'is\', \'going\', \'to\', \'kill\', \'me\', \'im\', \'this\', \'close\', \'to\', \'taking\', \'a\', \'shit\', \'on\', \'my\', \'phone\'] ",
n1045,3,1,0.6445,pathetic  display at  ,"[\'pathetic\', \'display\', \'at\'] ",
n1046,3,1,0.7119,get techy with another shout out to     ipad    chromebook  via ,"[\'get\', \'techy\', \'with\', \'another\', \'shout\', \'out\', \'to\', \'ipad\', \'chromebook\', \'via\'] ",
n1047,5,1,1,"but im beyond thankful for the help  gave me today  computer was defective and they replaced it, while i just payed the difference","[\'but\', \'im\', \'beyond\', \'thankful\', \'for\', \'the\', \'help\', \'gave\', \'me\', \'today\', \'computer\', \'was\', \'defective\', \'and\', \'they\', \'replaced\', \'it\', \'while\', \'i\', \'just\', \'payed\', \'the\', \'difference\'] ",
n1048,3,1,0.6932,"new ha blog post  gt  gt  gt  final  aapl  putcallratios for wednesday, december 3, 2014   ","[\'new\', \'ha\', \'blog\', \'post\', \'gt\', \'gt\', \'gt\', \'final\', \'aapl\', \'putcallratios\', \'for\', \'wednesday\', \'december\', \'3\', \'2014\'] ",
n1049,3,1,0.6464," mkt final  aapl  putcallratios for wednesday, december 3, 2014   ","[\'mkt\', \'final\', \'aapl\', \'putcallratios\', \'for\', \'wednesday\', \'december\', \'3\', \'2014\'] ",
n1051,3,1,0.6631,shipping estimates for 27 inch retina imac improve to 1 to 2 weeks  mac blog    aapl,"[\'shipping\', \'estimates\', \'for\', \'27\', \'inch\', \'retina\', \'imac\', \'improve\', \'to\', \'1\', \'to\', \'2\', \'weeks\', \'mac\', \'blog\', \'aapl\'] ",
n1053,3,1,1,got new cases   )     slc  citycreek  apple  applestore  red      ,"[\'got\', \'new\', \'cases\', \'slc\', \'citycreek\', \'apple\', \'applestore\', \'red\'] ",
n1054,1,0,1,if i fail poli sci because of this fucking laptop im suing ,"[\'if\', \'i\', \'fail\', \'poli\', \'sci\', \'because\', \'of\', \'this\', \'fucking\', \'laptop\', \'im\', \'suing\'] ",
n1055,5,1,0.7429,got new cases   )     slc  citycreek  apple  applestore  red  productred  aids  founda    ,"[\'got\', \'new\', \'cases\', \'slc\', \'citycreek\', \'apple\', \'applestore\', \'red\', \'productred\', \'aids\', \'founda\'] ",
n1056,3,1,1,"in worlds first  applewatch hackathon, apps and challenges emerge  via   aapl","[\'in\', \'worlds\', \'first\', \'applewatch\', \'hackathon\', \'apps\', \'and\', \'challenges\', \'emerge\', \'via\', \'aapl\'] ",
n1057,1,0,1,wtf   my phone is in do not disturb and im still getting notifications   fix this shit  ,"[\'wtf\', \'my\', \'phone\', \'is\', \'in\', \'do\', \'not\', \'disturb\', \'and\', \'im\', \'still\', \'getting\', \'notifications\', \'fix\', \'this\', \'shit\'] ",
n1058,1,0,1,currently on hold with  in cupertino to try to set up a genius bar appointment in madrid  dontask,"[\'currently\', \'on\', \'hold\', \'with\', \'in\', \'cupertino\', \'to\', \'try\', \'to\', \'set\', \'up\', \'a\', \'genius\', \'bar\', \'appointment\', \'in\', \'madrid\', \'dontask\'] ",
n1059,5,1,1,first tweet from my new   iphone 6 plus   newtoy,"[\'first\', \'tweet\', \'from\', \'my\', \'new\', \'iphone\', \'6\', \'plus\', \'newtoy\'] ",
n1060,3,1,0.6823,  fix this,"[\'fix\', \'this\'] ",
n1061,1,0,1,you just did too much you asshole   get your shit together ,"[\'you\', \'just\', \'did\', \'too\', \'much\', \'you\', \'asshole\', \'get\', \'your\', \'shit\', \'together\'] ",
n1062,1,0,1,so  wouldnt fix my phone and claims that i didnt tell them to screen was fucked ,"[\'so\', \'wouldnt\', \'fix\', \'my\', \'phone\', \'and\', \'claims\', \'that\', \'i\', \'didnt\', \'tell\', \'them\', \'to\', \'screen\', \'was\', \'fucked\'] ",
n1063,3,1,0.6598, aapl did carl icahn cause a new private equity bubble?   ,"[\'aapl\', \'did\', \'carl\', \'icahn\', \'cause\', \'a\', \'new\', \'private\', \'equity\', \'bubble\'] ",
n1065,3,1,1, ischool?   education ,"[\'ischool\', \'education\'] ",
n1066,3,1,0.7481," can we always have the setting when i use the app for location for apps, instead of just always and never?","[\'can\', \'we\', \'always\', \'have\', \'the\', \'setting\', \'when\', \'i\', \'use\', \'the\', \'app\', \'for\', \'location\', \'for\', \'apps\', \'instead\', \'of\', \'just\', \'always\', \'and\', \'never\'] ",
n1067,3,1,1, yall should put the apple symbol into the home button on yalls next device,"[\'yall\', \'should\', \'put\', \'the\', \'apple\', \'symbol\', \'into\', \'the\', \'home\', \'button\', \'on\', \'yalls\', \'next\', \'device\'] ",
n1068,1,0,1," iphone6 users complain to    apple  about front  ( wednesday, 3  december) ","[\'iphone6\', \'users\', \'complain\', \'to\', \'apple\', \'about\', \'front\', \'wednesday\', \'3\', \'december\'] ",
n1069,3,1,1," verr _cktes  ger _cht   iphone6s zum    apple  watch  ( wednesday, 3  december) ","[\'verr\', \'_cktes\', \'ger\', \'_cht\', \'iphone6s\', \'zum\', \'apple\', \'watch\', \'wednesday\', \'3\', \'december\'] ",
n1070,3,1,0.6538,"how competition between wireless carriers benefits apple, inc    aapl","[\'how\', \'competition\', \'between\', \'wireless\', \'carriers\', \'benefits\', \'apple\', \'inc\', \'aapl\'] ",
n1071,3,1,1,jmp raises apple inc price target to  150 on exceptionally strong demand for       aapl,"[\'jmp\', \'raises\', \'apple\', \'inc\', \'price\', \'target\', \'to\', \'150\', \'on\', \'exceptionally\', \'strong\', \'demand\', \'for\', \'aapl\'] ",
n1072,3,1,1,"final  aapl  putcallratios for wednesday, december 3, 2014 ","[\'final\', \'aapl\', \'putcallratios\', \'for\', \'wednesday\', \'december\', \'3\', \'2014\'] ",
n1073,3,1,0.6803,new post on my blog  got new cases   )     slc  citycreek  apple  applestore  red  pr    ,"[\'new\', \'post\', \'on\', \'my\', \'blog\', \'got\', \'new\', \'cases\', \'slc\', \'citycreek\', \'apple\', \'applestore\', \'red\', \'pr\'] ",
n1074,5,1,0.6624,got new cases   )     slc  citycreek  apple  applestore  red      ,"[\'got\', \'new\', \'cases\', \'slc\', \'citycreek\', \'apple\', \'applestore\', \'red\'] ",
n1075,3,1,1,   and replied     livingthedream  ari,"[\'and\', \'replied\', \'livingthedream\', \'ari\'] ",
n1076,3,1,1,check out our founder  views on   amp    eggfreezing benefits for female engineers    womenintech,"[\'check\', \'out\', \'our\', \'founder\', \'views\', \'on\', \'amp\', \'eggfreezing\', \'benefits\', \'for\', \'female\', \'engineers\', \'womenintech\'] ",
n1077,3,1,0.6722,  channels  in a hilarious ad for its new catalog  bookbook via  time  ikea  ,"[\'channels\', \'in\', \'a\', \'hilarious\', \'ad\', \'for\', \'its\', \'new\', \'catalog\', \'bookbook\', \'via\', \'time\', \'ikea\'] ",
n1078,3,1,0.6675,"our fda cleared, smartphone connected thermometer is now at  stores!   holiday ","[\'our\', \'fda\', \'cleared\', \'smartphone\', \'connected\', \'thermometer\', \'is\', \'now\', \'at\', \'stores\', \'holiday\'] ",
n1079,3,1,0.6971,rt     and replied     livingthedream  ari,"[\'rt\', \'and\', \'replied\', \'livingthedream\', \'ari\'] ",
n1080,1,0,0.6492,  trumps  in streaming media sales ,"[\'trumps\', \'in\', \'streaming\', \'media\', \'sales\'] ",
n1081,1,0,1,apple secretly deleted ipod owners songs downloaded from competing music services   aapl,"[\'apple\', \'secretly\', \'deleted\', \'ipod\', \'owners\', \'songs\', \'downloaded\', \'from\', \'competing\', \'music\', \'services\', \'aapl\'] ",
n1082,1,0,1,"dear   \n \nwhy oh why do i have to baby sit copying files in the pos finder? its not like copying files is hard  oh wait, its you ","[\'dear\', \'why\', \'oh\', \'why\', \'do\', \'i\', \'have\', \'to\', \'baby\', \'sit\', \'copying\', \'files\', \'in\', \'the\', \'pos\', \'finder\', \'its\', \'not\', \'like\', \'copying\', \'files\', \'is\', \'hard\', \'oh\', \'wait\', \'its\', \'you\'] ",
n1083,3,1,1,apple ceo tim cook comes out as gay      via ,"[\'apple\', \'ceo\', \'tim\', \'cook\', \'comes\', \'out\', \'as\', \'gay\', \'via\'] ",
n1084,1,0,1, please get yourself together! i need my products to work!,"[\'please\', \'get\', \'yourself\', \'together\', \'i\', \'need\', \'my\', \'products\', \'to\', \'work\'] ",
n1085,1,0,0.7916,dear  \n \nnow its my fault that your pos macbook airquotes pro does not have fast ports  drop the pro in the future   toycomputer,"[\'dear\', \'now\', \'its\', \'my\', \'fault\', \'that\', \'your\', \'pos\', \'macbook\', \'airquotes\', \'pro\', \'does\', \'not\', \'have\', \'fast\', \'ports\', \'drop\', \'the\', \'pro\', \'in\', \'the\', \'future\', \'toycomputer\'] ",
n1086,1,0,1," hi! a few days ago i purchase 2 ringtones and non of them appear on my phone or purchased, but they appear in my credit card","[\'hi\', \'a\', \'few\', \'days\', \'ago\', \'i\', \'purchase\', \'2\', \'ringtones\', \'and\', \'non\', \'of\', \'them\', \'appear\', \'on\', \'my\', \'phone\', \'or\', \'purchased\', \'but\', \'they\', \'appear\', \'in\', \'my\', \'credit\', \'card\'] ",
n1087,3,1,0.667, dps developments  welove  aapl e and that new  retina screen ohai,"[\'dps\', \'developments\', \'welove\', \'aapl\', \'e\', \'and\', \'that\', \'new\', \'retina\', \'screen\', \'ohai\'] ",
n1088,5,1,0.344, if you didnt make such good products i would boycott you forever,"[\'if\', \'you\', \'didnt\', \'make\', \'such\', \'good\', \'products\', \'i\', \'would\', \'boycott\', \'you\', \'forever\'] ",
n1089,1,0,1,"as the sun devils were making their 20 2 run on us, my phone called 4 people and hung up on them all on its own  wtf!  iphoneissues ","[\'as\', \'the\', \'sun\', \'devils\', \'were\', \'making\', \'their\', \'20\', \'2\', \'run\', \'on\', \'us\', \'my\', \'phone\', \'called\', \'4\', \'people\', \'and\', \'hung\', \'up\', \'on\', \'them\', \'all\', \'on\', \'its\', \'own\', \'wtf\', \'iphoneissues\'] ",
n1090,1,0,1, apple admits it deleted songs purchased through competing stores from ipods         aapl  realnetworks,"[\'apple\', \'admits\', \'it\', \'deleted\', \'songs\', \'purchased\', \'through\', \'competing\', \'stores\', \'from\', \'ipods\', \'aapl\', \'realnetworks\'] ",
n1091,1,0,0.7177,  gotta switch to that android life  galaxy,"[\'gotta\', \'switch\', \'to\', \'that\', \'android\', \'life\', \'galaxy\'] ",
n1092,5,1,0.6933,"luv   iphone ive had pretty much all the iphones   3gs,  4 ,  4s ,  5c  amp    mobilephone  ","[\'luv\', \'iphone\', \'ive\', \'had\', \'pretty\', \'much\', \'all\', \'the\', \'iphones\', \'3gs\', \'4\', \'4s\', \'5c\', \'amp\', \'mobilephone\'] ",
n1093,1,0,0.6879,"not happy  have caused this to happen through a  osx system update, still on mavericks  ","[\'not\', \'happy\', \'have\', \'caused\', \'this\', \'to\', \'happen\', \'through\', \'a\', \'osx\', \'system\', \'update\', \'still\', \'on\', \'mavericks\'] ",
n1094,3,1,0.6584,  it only happened once   perhaps because i had no network? this is and was my setting   ,"[\'it\', \'only\', \'happened\', \'once\', \'perhaps\', \'because\', \'i\', \'had\', \'no\', \'network\', \'this\', \'is\', \'and\', \'was\', \'my\', \'setting\'] ",
n1095,1,0,1, is becoming very petty about not allowing certain apple dev resources work in chrome ,"[\'is\', \'becoming\', \'very\', \'petty\', \'about\', \'not\', \'allowing\', \'certain\', \'apple\', \'dev\', \'resources\', \'work\', \'in\', \'chrome\'] ",
n1096,1,0,0.6722,    i agree about apple  their customer service is based on condescending employees treating,"[\'i\', \'agree\', \'about\', \'apple\', \'their\', \'customer\', \'service\', \'is\', \'based\', \'on\', \'condescending\', \'employees\', \'treating\'] ",
n1097,3,1,0.6464,    customers as a captive audience ,"[\'customers\', \'as\', \'a\', \'captive\', \'audience\'] ",
n1098,3,1,1, win a  new   mini 3 with an  gift card! ,"[\'win\', \'a\', \'new\', \'mini\', \'3\', \'with\', \'an\', \'gift\', \'card\'] ",
n1099,1,0,0.6781,is there anything more maddening than notifications re appearing with app upgrade? ,"[\'is\', \'there\', \'anything\', \'more\', \'maddening\', \'than\', \'notifications\', \'re\', \'appearing\', \'with\', \'app\', \'upgrade\'] ",
n1100,3,1,1,hey  let us get some star wars action on itunes ,"[\'hey\', \'let\', \'us\', \'get\', \'some\', \'star\', \'wars\', \'action\', \'on\', \'itunes\'] ",
n1101,3,1,0.5497,we need an eye rolling emoji pronto ,"[\'we\', \'need\', \'an\', \'eye\', \'rolling\', \'emoji\', \'pronto\'] ",
n1102,3,1,0.5327,rt  we need an eye rolling emoji pronto ,"[\'rt\', \'we\', \'need\', \'an\', \'eye\', \'rolling\', \'emoji\', \'pronto\'] ",
n1103,1,0,1, your chargers suck,"[\'your\', \'chargers\', \'suck\'] ",
n1104,1,0,1,more  fuck you  ,"[\'more\', \'fuck\', \'you\'] ",
n1105,3,1,1,aw yeah! monarchywpb sticker to ride with  boommovement and  ,"[\'aw\', \'yeah\', \'monarchywpb\', \'sticker\', \'to\', \'ride\', \'with\', \'boommovement\', \'and\'] ",
n1106,1,0,0.6884, aapl apple inc  (aapl) falls for week because of monday morning drop   ,"[\'aapl\', \'apple\', \'inc\', \'aapl\', \'falls\', \'for\', \'week\', \'because\', \'of\', \'monday\', \'morning\', \'drop\'] ",
n1107,5,1,1,apple inc  ceo donates  291k to pennsylvania school district   aapl,"[\'apple\', \'inc\', \'ceo\', \'donates\', \'291k\', \'to\', \'pennsylvania\', \'school\', \'district\', \'aapl\'] ",
n1108,5,1,0.7454, runs the world  look around you,"[\'runs\', \'the\', \'world\', \'look\', \'around\', \'you\'] ",
n1109,3,1,0.6789,new questions in  mobile   goog  googl  aapl  amzn  fb  ssnlf ,"[\'new\', \'questions\', \'in\', \'mobile\', \'goog\', \'googl\', \'aapl\', \'amzn\', \'fb\', \'ssnlf\'] ",
n1110,3,1,1, patents system that changes the position of an iphone mid air \n  yay,"[\'patents\', \'system\', \'that\', \'changes\', \'the\', \'position\', \'of\', \'an\', \'iphone\', \'mid\', \'air\', \'yay\'] ",
n1111,1,0,1,my fix for syncdefaultsd crashing every five minutes and losing preference settings  keep system preferences open ,"[\'my\', \'fix\', \'for\', \'syncdefaultsd\', \'crashing\', \'every\', \'five\', \'minutes\', \'and\', \'losing\', \'preference\', \'settings\', \'keep\', \'system\', \'preferences\', \'open\'] ",
n1112,1,0,1, ios8 upgrade creates  cutandpaste problems  not impressed  anyone else ha,"[\'ios8\', \'upgrade\', \'creates\', \'cutandpaste\', \'problems\', \'not\', \'impressed\', \'anyone\', \'else\', \'ha\'] ",
n1113,1,0,1,"  my music library wont sync new music etc, itunes tells me sync completed, nothing new uploaded,how do i fix this? frustrating","[\'my\', \'music\', \'library\', \'wont\', \'sync\', \'new\', \'music\', \'etc\', \'itunes\', \'tells\', \'me\', \'sync\', \'completed\', \'nothing\', \'new\', \'uploaded\', \'how\', \'do\', \'i\', \'fix\', \'this\', \'frustrating\'] ",
n1114,1,0,1, fucking let everyone name the group chats their own things please and thanks,"[\'fucking\', \'let\', \'everyone\', \'name\', \'the\', \'group\', \'chats\', \'their\', \'own\', \'things\', \'please\', \'and\', \'thanks\'] ",
n1115,1,0,1, honestly sucks,"[\'honestly\', \'sucks\'] ",
n1116,1,0,0.6876,      you get 6ms ping  i get no connection  thanks  ,"[\'you\', \'get\', \'6ms\', \'ping\', \'i\', \'get\', \'no\', \'connection\', \'thanks\'] ",
n1117,1,0,0.6604, yosemite needs a lot more testing  just hooked machine to thunderbolt display and was greeted with this  ,"[\'yosemite\', \'needs\', \'a\', \'lot\', \'more\', \'testing\', \'just\', \'hooked\', \'machine\', \'to\', \'thunderbolt\', \'display\', \'and\', \'was\', \'greeted\', \'with\', \'this\'] ",
n1118,3,1,1,ironic that were at a pr event ( mp15) talking about companies that dont need more people talking about them (  ,"[\'ironic\', \'that\', \'were\', \'at\', \'a\', \'pr\', \'event\', \'mp15\', \'talking\', \'about\', \'companies\', \'that\', \'dont\', \'need\', \'more\', \'people\', \'talking\', \'about\', \'them\'] ",
n1119,1,0,1,how do i only have 12 7 gb used if my phone is 16 gb?  ,"[\'how\', \'do\', \'i\', \'only\', \'have\', \'12\', \'7\', \'gb\', \'used\', \'if\', \'my\', \'phone\', \'is\', \'16\', \'gb\'] ",
n1120,1,0,0.7073, make some better chargers fam or make them cheaper cuz rn this aint getting the job done,"[\'make\', \'some\', \'better\', \'chargers\', \'fam\', \'or\', \'make\', \'them\', \'cheaper\', \'cuz\', \'rn\', \'this\', \'aint\', \'getting\', \'the\', \'job\', \'done\'] ",
n1121,1,0,0.7877,has anyone figured out why  iphones randomly lose their contacts for a few hours for no reason?  wth,"[\'has\', \'anyone\', \'figured\', \'out\', \'why\', \'iphones\', \'randomly\', \'lose\', \'their\', \'contacts\', \'for\', \'a\', \'few\', \'hours\', \'for\', \'no\', \'reason\', \'wth\'] ",
n1122,1,0,0.9351,how can my phone die while plugged in wtf ,"[\'how\', \'can\', \'my\', \'phone\', \'die\', \'while\', \'plugged\', \'in\', \'wtf\'] ",
n1123,1,0,1,hey   im not a fan of your latest commercial!!,"[\'hey\', \'im\', \'not\', \'a\', \'fan\', \'of\', \'your\', \'latest\', \'commercial\'] ",
n1124,1,0,0.7368,how is 41 degrees nice weather  ,"[\'how\', \'is\', \'41\', \'degrees\', \'nice\', \'weather\'] ",
n1125,1,0,1, accused of deleting songs from  ipods without users knowledge ,"[\'accused\', \'of\', \'deleting\', \'songs\', \'from\', \'ipods\', \'without\', \'users\', \'knowledge\'] ",
n1126,3,1,1,    ughhhh can  just see itself out already ,"[\'ughhhh\', \'can\', \'just\', \'see\', \'itself\', \'out\', \'already\'] ",
n1127,1,0,0.5169, chrome books overtake  devices in the education market!  via ,"[\'chrome\', \'books\', \'overtake\', \'devices\', \'in\', \'the\', \'education\', \'market\', \'via\'] ",
n1128,3,1,1," aapl new, far reaching apple patent reveals next iphone may demonstrate a c   ","[\'aapl\', \'new\', \'far\', \'reaching\', \'apple\', \'patent\', \'reveals\', \'next\', \'iphone\', \'may\', \'demonstrate\', \'a\', \'c\'] ",
n1129,3,1,0.7079,alabama state representative to name anti discrimination bill after tim cook     aapl  apple  timcook,"[\'alabama\', \'state\', \'representative\', \'to\', \'name\', \'anti\', \'discrimination\', \'bill\', \'after\', \'tim\', \'cook\', \'aapl\', \'apple\', \'timcook\'] ",
n1130,3,1,0.6878, let me shake the phone to move the apps after double clicking the middle iphone button please,"[\'let\', \'me\', \'shake\', \'the\', \'phone\', \'to\', \'move\', \'the\', \'apps\', \'after\', \'double\', \'clicking\', \'the\', \'middle\', \'iphone\', \'button\', \'please\'] ",
n1131,1,0,1,over 1 hour on hold with  customer service trying to figure their messup o ,"[\'over\', \'1\', \'hour\', \'on\', \'hold\', \'with\', \'customer\', \'service\', \'trying\', \'to\', \'figure\', \'their\', \'messup\', \'o\'] ",
n1132,3,1,1, why isnt there an otter emoji,"[\'why\', \'isnt\', \'there\', \'an\', \'otter\', \'emoji\'] ",
n1133,3,1,0.6474, yh news apple patent could prevent cracked iphones  apple was awarded a patent for a gravity defying ha     ,"[\'yh\', \'news\', \'apple\', \'patent\', \'could\', \'prevent\', \'cracked\', \'iphones\', \'apple\', \'was\', \'awarded\', \'a\', \'patent\', \'for\', \'a\', \'gravity\', \'defying\', \'ha\'] ",
n1134,1,0,1,fuck you ,"[\'fuck\', \'you\'] ",
n1135,1,0,1,rt  fuck you ,"[\'rt\', \'fuck\', \'you\'] ",
n1136,3,1,0.678,type more than 100 words per minute with the new nintype keyboard for ios   aapl,"[\'type\', \'more\', \'than\', \'100\', \'words\', \'per\', \'minute\', \'with\', \'the\', \'new\', \'nintype\', \'keyboard\', \'for\', \'ios\', \'aapl\'] ",
n1137,1,0,1,iphone chargers can suck my ass   disappointed,"[\'iphone\', \'chargers\', \'can\', \'suck\', \'my\', \'ass\', \'disappointed\'] ",
n1138,3,1,1, russia could  ban  apple inc   iphone for  lawmakers      aapl  tech \n \nfor reverse  security reasons,"[\'russia\', \'could\', \'ban\', \'apple\', \'inc\', \'iphone\', \'for\', \'lawmakers\', \'aapl\', \'tech\', \'for\', \'reverse\', \'security\', \'reasons\'] ",
n1139,1,0,0.6828,aye forreal tho done w yo bs ,"[\'aye\', \'forreal\', \'tho\', \'done\', \'w\', \'yo\', \'bs\'] ",
n1140,3,1,1,  between 4 and 8,"[\'between\', \'4\', \'and\', \'8\'] ",
n1141,1,0,1, how does the word demographic not have any synonyms attached in your dictionary application  incompetence,"[\'how\', \'does\', \'the\', \'word\', \'demographic\', \'not\', \'have\', \'any\', \'synonyms\', \'attached\', \'in\', \'your\', \'dictionary\', \'application\', \'incompetence\'] ",
n1143,1,0,1,wtf  yall shit be cheap  ,"[\'wtf\', \'yall\', \'shit\', \'be\', \'cheap\'] ",
n1144,3,1,0.6774, aapl alabama anti discrimination bill to be named after apples tim cook   ,"[\'aapl\', \'alabama\', \'anti\', \'discrimination\', \'bill\', \'to\', \'be\', \'named\', \'after\', \'apples\', \'tim\', \'cook\'] ",
n1145,1,0,1,rt  wtf  yall shit be cheap  ,"[\'rt\', \'wtf\', \'yall\', \'shit\', \'be\', \'cheap\'] ",
n1146,3,1,0.6528," win a  digital makeover  giveaway !  1000  gc, ipad  macbook and more !   pin","[\'win\', \'a\', \'digital\', \'makeover\', \'giveaway\', \'1000\', \'gc\', \'ipad\', \'macbook\', \'and\', \'more\', \'pin\'] ",
n1147,3,1,1, need to hurry up and make a middle finger emoji,"[\'need\', \'to\', \'hurry\', \'up\', \'and\', \'make\', \'a\', \'middle\', \'finger\', \'emoji\'] ",
n1148,1,0,1,iphone battery life takes the piss sort it out  iphone  iphone  apple ,"[\'iphone\', \'battery\', \'life\', \'takes\', \'the\', \'piss\', \'sort\', \'it\', \'out\', \'iphone\', \'iphone\', \'apple\'] ",
n1149,3,1,0.6618, aapl bloomberg law   1 billion antitrust suit against apple (audio)   ,"[\'aapl\', \'bloomberg\', \'law\', \'1\', \'billion\', \'antitrust\', \'suit\', \'against\', \'apple\', \'audio\'] ",
n1150,1,0,1,"seriously wtf iphone  its been fucking up all day, now it wont let me set my alarm for my 9 30 lecture  fkn  you can pay my tuition","[\'seriously\', \'wtf\', \'iphone\', \'its\', \'been\', \'fucking\', \'up\', \'all\', \'day\', \'now\', \'it\', \'wont\', \'let\', \'me\', \'set\', \'my\', \'alarm\', \'for\', \'my\', \'9\', \'30\', \'lecture\', \'fkn\', \'you\', \'can\', \'pay\', \'my\', \'tuition\'] ",
n1151,1,0,0.6752,  true   silly iphone  get your life together,"[\'true\', \'silly\', \'iphone\', \'get\', \'your\', \'life\', \'together\'] ",
n1152,1,0,1,rt    true   silly iphone  get your life together,"[\'rt\', \'true\', \'silly\', \'iphone\', \'get\', \'your\', \'life\', \'together\'] ",
n1153,1,0,0.6758, u niggas really put this weak ass album n this gay ass artwork on my iphone? im bout to go buy my first galaxy ,"[\'u\', \'niggas\', \'really\', \'put\', \'this\', \'weak\', \'ass\', \'album\', \'n\', \'this\', \'gay\', \'ass\', \'artwork\', \'on\', \'my\', \'iphone\', \'im\', \'bout\', \'to\', \'go\', \'buy\', \'my\', \'first\', \'galaxy\'] ",
n1154,1,0,0.6708,apple inc  fails app store trademark appeal   aapl,"[\'apple\', \'inc\', \'fails\', \'app\', \'store\', \'trademark\', \'appeal\', \'aapl\'] ",
n1155,1,0,0.739, removed songs from ipods without telling customers ,"[\'removed\', \'songs\', \'from\', \'ipods\', \'without\', \'telling\', \'customers\'] ",
