Index,sentiment,binary_value,sentiment:confidence,text,tokens ,Column12
n1994,3,1,1,photographing the white house christmas decorations with an iphone 6 by    ,"[\'photographing\', \'the\', \'white\', \'house\', \'christmas\', \'decorations\', \'with\', \'an\', \'iphone\', \'6\', \'by\'] ",
n1995,3,1,0.7423,"thestreet    google has major headaches going into 2015 because of  apple,  facebook   aapl  fb  goog ","[\'thestreet\', \'google\', \'has\', \'major\', \'headaches\', \'going\', \'into\', \'2015\', \'because\', \'of\', \'apple\', \'facebook\', \'aapl\', \'fb\', \'goog\'] ",
n1996,3,1,0.7177,hey   urbannutcracker russell ferguson   amp   krumpers are  store in boylston st    today  dancing  amp  chat,"[\'hey\', \'urbannutcracker\', \'russell\', \'ferguson\', \'amp\', \'krumpers\', \'are\', \'store\', \'in\', \'boylston\', \'st\', \'today\', \'dancing\', \'amp\', \'chat\'] ",
n1997,3,1,1,is  apple hedging its bets with another small  iphone?  aapl ,"[\'is\', \'apple\', \'hedging\', \'its\', \'bets\', \'with\', \'another\', \'small\', \'iphone\', \'aapl\'] ",
n1998,3,1,0.7378,apple inc  defendants take the stand in anti trust lawsuit   aapl  antitrust,"[\'apple\', \'inc\', \'defendants\', \'take\', \'the\', \'stand\', \'in\', \'anti\', \'trust\', \'lawsuit\', \'aapl\', \'antitrust\'] ",
n1999,5,1,0.9456,rt  congrats to  mary sotos  for green power leadership awards  \n,"[\'rt\', \'congrats\', \'to\', \'mary\', \'sotos\', \'for\', \'green\', \'power\', \'leadership\', \'awards\'] ",
n2000,3,1,1,pop up  bostonholiday    urbannutcrackers   amp   krumpers are  store in boylston st   today  dancing  amp  chat,"[\'pop\', \'up\', \'bostonholiday\', \'urbannutcrackers\', \'amp\', \'krumpers\', \'are\', \'store\', \'in\', \'boylston\', \'st\', \'today\', \'dancing\', \'amp\', \'chat\'] ",
n2001,3,1,1,new 4 inch iphone 6 reported  5 reasons apple must make it   aapl  aapl \n,"[\'new\', \'4\', \'inch\', \'iphone\', \'6\', \'reported\', \'5\', \'reasons\', \'apple\', \'must\', \'make\', \'it\', \'aapl\', \'aapl\'] ",
n2002,1,0,0.6796, gbp200 repair an  iphone5 that died 4 mths out of warranty  the new phone comes with only 90 days warranty  why?!?!  unhappycustomer,"[\'gbp200\', \'repair\', \'an\', \'iphone5\', \'that\', \'died\', \'4\', \'mths\', \'out\', \'of\', \'warranty\', \'the\', \'new\', \'phone\', \'comes\', \'with\', \'only\', \'90\', \'days\', \'warranty\', \'why\', \'unhappycustomer\'] ",
n2003,3,1,1,foreign currency exchange may be a headwind for  apple  aapl ,"[\'foreign\', \'currency\', \'exchange\', \'may\', \'be\', \'a\', \'headwind\', \'for\', \'apple\', \'aapl\'] ",
n2004,1,0,1,mark  zuckerberg slams tim  cook  you dont care about your customers  fb  aapl  ,"[\'mark\', \'zuckerberg\', \'slams\', \'tim\', \'cook\', \'you\', \'dont\', \'care\', \'about\', \'your\', \'customers\', \'fb\', \'aapl\'] ",
n2005,5,1,1,  i cant say enough about how awesome apple has been  theyve already processed a reorder for the phone that ups lost,"[\'i\', \'cant\', \'say\', \'enough\', \'about\', \'how\', \'awesome\', \'apple\', \'has\', \'been\', \'theyve\', \'already\', \'processed\', \'a\', \'reorder\', \'for\', \'the\', \'phone\', \'that\', \'ups\', \'lost\'] ",
n2006,3,1,0.7315,"  samsung  appeals  930m fine in    apple   iphone copying case  ( friday, 5  december) ","[\'samsung\', \'appeals\', \'930m\', \'fine\', \'in\', \'apple\', \'iphone\', \'copying\', \'case\', \'friday\', \'5\', \'december\'] ",
n2007,3,1,0.6803,block trade detected in  aapl,"[\'block\', \'trade\', \'detected\', \'in\', \'aapl\'] ",
n2008,3,1,1,is apple inc  losing the  5 billion ed tech market?   aapl,"[\'is\', \'apple\', \'inc\', \'losing\', \'the\', \'5\', \'billion\', \'ed\', \'tech\', \'market\', \'aapl\'] ",
n2009,3,1,1,any one know how to retrieve deleted texts from iphone    apple   textmessage,"[\'any\', \'one\', \'know\', \'how\', \'to\', \'retrieve\', \'deleted\', \'texts\', \'from\', \'iphone\', \'apple\', \'textmessage\'] ",
n2010,3,1,1,apple   fibonacci technicals levels   intraday  update    aapl  aapl  \n,"[\'apple\', \'fibonacci\', \'technicals\', \'levels\', \'intraday\', \'update\', \'aapl\', \'aapl\'] ",
n2011,3,1,1, aapl apple is building a  161 million theatre   ,"[\'aapl\', \'apple\', \'is\', \'building\', \'a\', \'161\', \'million\', \'theatre\'] ",
n2012,1,0,1,mark  zuckerberg slams tim  cook  youre not in alignment with your customers  fb  aapl  ,"[\'mark\', \'zuckerberg\', \'slams\', \'tim\', \'cook\', \'youre\', \'not\', \'in\', \'alignment\', \'with\', \'your\', \'customers\', \'fb\', \'aapl\'] ",
n2013,3,1,0.7436,apple begins hiring for first belgian retail store in brussels  mac blog    aapl,"[\'apple\', \'begins\', \'hiring\', \'for\', \'first\', \'belgian\', \'retail\', \'store\', \'in\', \'brussels\', \'mac\', \'blog\', \'aapl\'] ",
n2014,3,1,1,apple launches ten holiday themed itunes radio stations  ios blog    aapl,"[\'apple\', \'launches\', \'ten\', \'holiday\', \'themed\', \'itunes\', \'radio\', \'stations\', \'ios\', \'blog\', \'aapl\'] ",
n2015,1,0,0.6752, deleted  ipod  music from rival services ,"[\'deleted\', \'ipod\', \'music\', \'from\', \'rival\', \'services\'] ",
n2016,3,1,0.7039,apple throws last minute curve ball in lawsuit  aapl  aapl \n,"[\'apple\', \'throws\', \'last\', \'minute\', \'curve\', \'ball\', \'in\', \'lawsuit\', \'aapl\', \'aapl\'] ",
n2017,3,1,1,3 reasons  apple is a potential warren buffett stock and 1 reason it isnt   the motley fool  aapl ,"[\'3\', \'reasons\', \'apple\', \'is\', \'a\', \'potential\', \'warren\', \'buffett\', \'stock\', \'and\', \'1\', \'reason\', \'it\', \'isnt\', \'the\', \'motley\', \'fool\', \'aapl\'] ",
n2018,3,1,1,is  apple inc  losing the  5 billion ed tech market?   the motley fool  aapl ,"[\'is\', \'apple\', \'inc\', \'losing\', \'the\', \'5\', \'billion\', \'ed\', \'tech\', \'market\', \'the\', \'motley\', \'fool\', \'aapl\'] ",
n2019,3,1,0.7977,apple intraday comments   updated range   premium users   aapl  stockaction  trading  stocks  mkt\n,"[\'apple\', \'intraday\', \'comments\', \'updated\', \'range\', \'premium\', \'users\', \'aapl\', \'stockaction\', \'trading\', \'stocks\', \'mkt\'] ",
n2020,3,1,1,attn     buy these guys  amp  make  appletv what it should be  fan tv heads for the exit    via ,"[\'attn\', \'buy\', \'these\', \'guys\', \'amp\', \'make\', \'appletv\', \'what\', \'it\', \'should\', \'be\', \'fan\', \'tv\', \'heads\', \'for\', \'the\', \'exit\', \'via\'] ",
n2021,5,1,1, excellent customer service thanks ian  applestorecoventgarden,"[\'excellent\', \'customer\', \'service\', \'thanks\', \'ian\', \'applestorecoventgarden\'] ",
n2023,1,0,1, why i cannot alt tab back to full screen app!? grrrr!  usability,"[\'why\', \'i\', \'cannot\', \'alt\', \'tab\', \'back\', \'to\', \'full\', \'screen\', \'app\', \'grrrr\', \'usability\'] ",
n2024,3,1,1, to host free  coding workshops in stores ,"[\'to\', \'host\', \'free\', \'coding\', \'workshops\', \'in\', \'stores\'] ",
n2025,3,1,0.6584, apple begins hiring retail positions in brussels ahead of first  belgium         aapl ,"[\'apple\', \'begins\', \'hiring\', \'retail\', \'positions\', \'in\', \'brussels\', \'ahead\', \'of\', \'first\', \'belgium\', \'aapl\'] ",
n2026,3,1,1,apple   fibonacci technicals levels   intraday  update    aapl  aapl  \n,"[\'apple\', \'fibonacci\', \'technicals\', \'levels\', \'intraday\', \'update\', \'aapl\', \'aapl\'] ",
n2027,3,1,1,"rt  studio at 45,000 ft   one outlet,  4 computers    we need the batteries of the future now!!!! ","[\'rt\', \'studio\', \'at\', \'45\', \'000\', \'ft\', \'one\', \'outlet\', \'4\', \'computers\', \'we\', \'need\', \'the\', \'batteries\', \'of\', \'the\', \'future\', \'now\'] ",
n2028,3,1,0.6705, awards  with distinguished school honor    \n ipads,"[\'awards\', \'with\', \'distinguished\', \'school\', \'honor\', \'ipads\'] ",
n2029,1,0,0.9357, why the fuck when i leave my charger at home do i gotta start sending my goodbye texts at 10 09am?,"[\'why\', \'the\', \'fuck\', \'when\', \'i\', \'leave\', \'my\', \'charger\', \'at\', \'home\', \'do\', \'i\', \'gotta\', \'start\', \'sending\', \'my\', \'goodbye\', \'texts\', \'at\', \'10\', \'09am\'] ",
n2030,3,1,0.6517,"hey  while your reading list on safari across device rocks, can you please let list items to be deleted (x) in iphone","[\'hey\', \'while\', \'your\', \'reading\', \'list\', \'on\', \'safari\', \'across\', \'device\', \'rocks\', \'can\', \'you\', \'please\', \'let\', \'list\', \'items\', \'to\', \'be\', \'deleted\', \'x\', \'in\', \'iphone\'] ",
n2031,5,1,0.6784,how apple became one of the greenest companies in america     energy  efficiency,"[\'how\', \'apple\', \'became\', \'one\', \'of\', \'the\', \'greenest\', \'companies\', \'in\', \'america\', \'energy\', \'efficiency\'] ",
n2032,3,1,0.9287, why doesnt  give out free apples as snacks?,"[\'why\', \'doesnt\', \'give\', \'out\', \'free\', \'apples\', \'as\', \'snacks\'] ",
n2033,3,1,0.6527,foreign currency exchange may be a headwind for apple (aapl)   aapl,"[\'foreign\', \'currency\', \'exchange\', \'may\', \'be\', \'a\', \'headwind\', \'for\', \'apple\', \'aapl\', \'aapl\'] ",
n2034,3,1,0.6861," and qs,  aapl","[\'and\', \'qs\', \'aapl\'] ",
n2035,3,1,1,is apple inc  losing the  5 billion ed tech market?  aapl  aapl \n,"[\'is\', \'apple\', \'inc\', \'losing\', \'the\', \'5\', \'billion\', \'ed\', \'tech\', \'market\', \'aapl\', \'aapl\'] ",
n2036,1,0,1,rt  yea let me just pay 600 dollars for phone so it dies at 30  fix your shit ,"[\'rt\', \'yea\', \'let\', \'me\', \'just\', \'pay\', \'600\', \'dollars\', \'for\', \'phone\', \'so\', \'it\', \'dies\', \'at\', \'30\', \'fix\', \'your\', \'shit\'] ",
n2037,1,0,1, founder attacks  boss over ridiculous comments ,"[\'founder\', \'attacks\', \'boss\', \'over\', \'ridiculous\', \'comments\'] ",
n2038,3,1,0.5062,"rt  studio at 45,000 ft   one outlet,  4 computers    we need the batteries of the future now!!!! ","[\'rt\', \'studio\', \'at\', \'45\', \'000\', \'ft\', \'one\', \'outlet\', \'4\', \'computers\', \'we\', \'need\', \'the\', \'batteries\', \'of\', \'the\', \'future\', \'now\'] ",
n2039,1,0,1,"dear  i place all my browser eggs in the  safari basket  guess what? safari is broken, please fix the release you pulled   fail","[\'dear\', \'i\', \'place\', \'all\', \'my\', \'browser\', \'eggs\', \'in\', \'the\', \'safari\', \'basket\', \'guess\', \'what\', \'safari\', \'is\', \'broken\', \'please\', \'fix\', \'the\', \'release\', \'you\', \'pulled\', \'fail\'] ",
n2040,3,1,0.6581,"jmp securities thinks apple, inc  is going to  150  time to sell?   aapl","[\'jmp\', \'securities\', \'thinks\', \'apple\', \'inc\', \'is\', \'going\', \'to\', \'150\', \'time\', \'to\', \'sell\', \'aapl\'] ",
n2041,1,0,0.6595,"foxconn robots proving unsuitable for iphone assembly, updated versions in the works   aapl","[\'foxconn\', \'robots\', \'proving\', \'unsuitable\', \'for\', \'iphone\', \'assembly\', \'updated\', \'versions\', \'in\', \'the\', \'works\', \'aapl\'] ",
n2042,3,1,1,anti discrimination bill to be named after  ceo   via    lgbt  gayrights  alabama,"[\'anti\', \'discrimination\', \'bill\', \'to\', \'be\', \'named\', \'after\', \'ceo\', \'via\', \'lgbt\', \'gayrights\', \'alabama\'] ",
n2043,3,1,1,apple   115 fits to 8 4  increase in earnings  use 2014q3 eps  1 42 in   free ios app donkey stocks   aapl \n,"[\'apple\', \'115\', \'fits\', \'to\', \'8\', \'4\', \'increase\', \'in\', \'earnings\', \'use\', \'2014q3\', \'eps\', \'1\', \'42\', \'in\', \'free\', \'ios\', \'app\', \'donkey\', \'stocks\', \'aapl\'] ",
n2044,5,1,1,the king of the phablets! apples iphone 6 plus is bestseller for past three months    aapl  aapl \n,"[\'the\', \'king\', \'of\', \'the\', \'phablets\', \'apples\', \'iphone\', \'6\', \'plus\', \'is\', \'bestseller\', \'for\', \'past\', \'three\', \'months\', \'aapl\', \'aapl\'] ",
n2045,1,0,0.6758,what is the point of making an apt at  genius bar when you sit and wait for 40 min and counting?!,"[\'what\', \'is\', \'the\', \'point\', \'of\', \'making\', \'an\', \'apt\', \'at\', \'genius\', \'bar\', \'when\', \'you\', \'sit\', \'and\', \'wait\', \'for\', \'40\', \'min\', \'and\', \'counting\'] ",
n2046,3,1,0.7089,new 4 inch  iphone6 reported  5 reasons  must make it   choice  device  smartphone  budget,"[\'new\', \'4\', \'inch\', \'iphone6\', \'reported\', \'5\', \'reasons\', \'must\', \'make\', \'it\', \'choice\', \'device\', \'smartphone\', \'budget\'] ",
n2047,3,1,0.734,will  be growing its services areas?   thinks it   ,"[\'will\', \'be\', \'growing\', \'its\', \'services\', \'areas\', \'thinks\', \'it\'] ",
n2049,3,1,1,"jmp securities thinks  apple, inc  is going to  150  time to sell?   the motley fool  aapl ","[\'jmp\', \'securities\', \'thinks\', \'apple\', \'inc\', \'is\', \'going\', \'to\', \'150\', \'time\', \'to\', \'sell\', \'the\', \'motley\', \'fool\', \'aapl\'] ",
n2050,3,1,1,how to save a ton of money when you buy your next  iphone via   aapl ,"[\'how\', \'to\', \'save\', \'a\', \'ton\', \'of\', \'money\', \'when\', \'you\', \'buy\', \'your\', \'next\', \'iphone\', \'via\', \'aapl\'] ",
n2051,3,1,0.4963, aapl  bidu  ntes and more are on our stocks to buy list  aapl  bidu  ntes ,"[\'aapl\', \'bidu\', \'ntes\', \'and\', \'more\', \'are\', \'on\', \'our\', \'stocks\', \'to\', \'buy\', \'list\', \'aapl\', \'bidu\', \'ntes\'] ",
n2052,3,1,0.6882,resisting a bite of the  holiday     ,"[\'resisting\', \'a\', \'bite\', \'of\', \'the\', \'holiday\'] ",
n2053,1,0,0.5032,rt  your telling me theres no santa claus emoji? ,"[\'rt\', \'your\', \'telling\', \'me\', \'theres\', \'no\', \'santa\', \'claus\', \'emoji\'] ",
n2054,3,1,0.6953,apple   115 fits to 8 4  increase in earnings  use 2014q3 eps  1 42 in   free ios app donkey stocks   aapl \n,"[\'apple\', \'115\', \'fits\', \'to\', \'8\', \'4\', \'increase\', \'in\', \'earnings\', \'use\', \'2014q3\', \'eps\', \'1\', \'42\', \'in\', \'free\', \'ios\', \'app\', \'donkey\', \'stocks\', \'aapl\'] ",
n2055,3,1,1, are you doing 12 days of gifts again?,"[\'are\', \'you\', \'doing\', \'12\', \'days\', \'of\', \'gifts\', \'again\'] ",
n2056,3,1,1, apple  market maker price range forecast update  aapl ,"[\'apple\', \'market\', \'maker\', \'price\', \'range\', \'forecast\', \'update\', \'aapl\'] ",
n2057,3,1,1,   its similar to an existing app (called cardio guru interestingly)  maybe apple have noticed this?,"[\'its\', \'similar\', \'to\', \'an\', \'existing\', \'app\', \'called\', \'cardio\', \'guru\', \'interestingly\', \'maybe\', \'apple\', \'have\', \'noticed\', \'this\'] ",
n2058,1,0,1,   hasnt apple been doing this for decades? this is why i dont support apple   apple  deletegame,"[\'hasnt\', \'apple\', \'been\', \'doing\', \'this\', \'for\', \'decades\', \'this\', \'is\', \'why\', \'i\', \'dont\', \'support\', \'apple\', \'apple\', \'deletegame\'] ",
n2059,3,1,1,crystal baller  rebirth of the 4 inch iphone and other insane apple rumors  aapl  aapl \n,"[\'crystal\', \'baller\', \'rebirth\', \'of\', \'the\', \'4\', \'inch\', \'iphone\', \'and\', \'other\', \'insane\', \'apple\', \'rumors\', \'aapl\', \'aapl\'] ",
n2060,3,1,0.6779, aapl new 4 inch iphone 6 reported  5 reasons apple must make it   ,"[\'aapl\', \'new\', \'4\', \'inch\', \'iphone\', \'6\', \'reported\', \'5\', \'reasons\', \'apple\', \'must\', \'make\', \'it\'] ",
n2061,3,1,1,rt  crystal baller  rebirth of the 4 inch iphone and other insane apple rumors  aapl  aapl \n,"[\'rt\', \'crystal\', \'baller\', \'rebirth\', \'of\', \'the\', \'4\', \'inch\', \'iphone\', \'and\', \'other\', \'insane\', \'apple\', \'rumors\', \'aapl\', \'aapl\'] ",
n2062,5,1,0.5364,"watching  orion  eft1 reenter at 20,000mph on my   iphone as i am driving 80mph through the middle of no  amp  where texas   howcoolisthat","[\'watching\', \'orion\', \'eft1\', \'reenter\', \'at\', \'20\', \'000mph\', \'on\', \'my\', \'iphone\', \'as\', \'i\', \'am\', \'driving\', \'80mph\', \'through\', \'the\', \'middle\', \'of\', \'no\', \'amp\', \'where\', \'texas\', \'howcoolisthat\'] ",
n2063,3,1,0.667,interesting job wth  in crowdsourcing! (tip via  on li) maps community client software engineer ,"[\'interesting\', \'job\', \'wth\', \'in\', \'crowdsourcing\', \'tip\', \'via\', \'on\', \'li\', \'maps\', \'community\', \'client\', \'software\', \'engineer\'] ",
n2064,1,0,0.5207,   its definitely a bit frustrating as a consumer  im a big  supporter,"[\'its\', \'definitely\', \'a\', \'bit\', \'frustrating\', \'as\', \'a\', \'consumer\', \'im\', \'a\', \'big\', \'supporter\'] ",
n2065,3,1,0.6587,   just saw this one on  ,"[\'just\', \'saw\', \'this\', \'one\', \'on\'] ",
n2066,3,1,0.652, aapl outside the box  how things changed this week  good jobs and bad jobs   ,"[\'aapl\', \'outside\', \'the\', \'box\', \'how\', \'things\', \'changed\', \'this\', \'week\', \'good\', \'jobs\', \'and\', \'bad\', \'jobs\'] ",
n2067,3,1,1,apple   fibonacci technicals levels   intraday  update    aapl  aapl  \n,"[\'apple\', \'fibonacci\', \'technicals\', \'levels\', \'intraday\', \'update\', \'aapl\', \'aapl\'] ",
n2068,3,1,0.6783,help  store rep told me that itunes backup saves multiple backups  but i backed up phone now and old backup is gone  what to do?,"[\'help\', \'store\', \'rep\', \'told\', \'me\', \'that\', \'itunes\', \'backup\', \'saves\', \'multiple\', \'backups\', \'but\', \'i\', \'backed\', \'up\', \'phone\', \'now\', \'and\', \'old\', \'backup\', \'is\', \'gone\', \'what\', \'to\', \'do\'] ",
n2069,3,1,1,  nice! if the actor had on an iwatch hed have the entire suite of  products   sponsordeal,"[\'nice\', \'if\', \'the\', \'actor\', \'had\', \'on\', \'an\', \'iwatch\', \'hed\', \'have\', \'the\', \'entire\', \'suite\', \'of\', \'products\', \'sponsordeal\'] ",
n2070,1,0,1,why i hate  apple   aapl  ,"[\'why\', \'i\', \'hate\', \'apple\', \'aapl\'] ",
n2071,1,0,1,my  power cord caught on fire!   yet another non travelling power cord i have less than a year    applecordfire ,"[\'my\', \'power\', \'cord\', \'caught\', \'on\', \'fire\', \'yet\', \'another\', \'non\', \'travelling\', \'power\', \'cord\', \'i\', \'have\', \'less\', \'than\', \'a\', \'year\', \'applecordfire\'] ",
n2072,1,0,1,what i find alarming about  power cords is how quickly they fray   i dont always notice when i dont travel with them   applecordfire,"[\'what\', \'i\', \'find\', \'alarming\', \'about\', \'power\', \'cords\', \'is\', \'how\', \'quickly\', \'they\', \'fray\', \'i\', \'dont\', \'always\', \'notice\', \'when\', \'i\', \'dont\', \'travel\', \'with\', \'them\', \'applecordfire\'] ",
n2073,1,0,0.6861,"and if i leave my mac plugged in when i leave the house, do i need to check the  power cord every time?   applecordfire","[\'and\', \'if\', \'i\', \'leave\', \'my\', \'mac\', \'plugged\', \'in\', \'when\', \'i\', \'leave\', \'the\', \'house\', \'do\', \'i\', \'need\', \'to\', \'check\', \'the\', \'power\', \'cord\', \'every\', \'time\', \'applecordfire\'] ",
n2074,1,0,1,and how about kids?  do parents need to monitor the  power cords daily to make sure they are still safe?   applecordfire,"[\'and\', \'how\', \'about\', \'kids\', \'do\', \'parents\', \'need\', \'to\', \'monitor\', \'the\', \'power\', \'cords\', \'daily\', \'to\', \'make\', \'sure\', \'they\', \'are\', \'still\', \'safe\', \'applecordfire\'] ",
n2075,1,0,1,"i was out to dinner last night and left my computer to charge   had the fire happened then, id have no house     applecordfire","[\'i\', \'was\', \'out\', \'to\', \'dinner\', \'last\', \'night\', \'and\', \'left\', \'my\', \'computer\', \'to\', \'charge\', \'had\', \'the\', \'fire\', \'happened\', \'then\', \'id\', \'have\', \'no\', \'house\', \'applecordfire\'] ",
n2076,3,1,0.6791,how hip is   store in boylston st  today at 6 30pm  enjoy some  krumping meet  urbannutcracker director  amp  ,"[\'how\', \'hip\', \'is\', \'store\', \'in\', \'boylston\', \'st\', \'today\', \'at\', \'6\', \'30pm\', \'enjoy\', \'some\', \'krumping\', \'meet\', \'urbannutcracker\', \'director\', \'amp\'] ",
n2077,3,1,1,ubs says consensus on december quarter apple  iphone units could be 10  low  aapl  aapl \n,"[\'ubs\', \'says\', \'consensus\', \'on\', \'december\', \'quarter\', \'apple\', \'iphone\', \'units\', \'could\', \'be\', \'10\', \'low\', \'aapl\', \'aapl\'] ",
n2078,3,1,1,   passion for engineering design at the heart of what he did for   via ,"[\'passion\', \'for\', \'engineering\', \'design\', \'at\', \'the\', \'heart\', \'of\', \'what\', \'he\', \'did\', \'for\', \'via\'] ",
n2079,3,1,1,in the market to create more videos with my students   macbook  via ,"[\'in\', \'the\', \'market\', \'to\', \'create\', \'more\', \'videos\', \'with\', \'my\', \'students\', \'macbook\', \'via\'] ",
n2080,3,1,1,bloombergtv   steve  wozniak on what really happened in  jobs garage  via   apple  aapl,"[\'bloombergtv\', \'steve\', \'wozniak\', \'on\', \'what\', \'really\', \'happened\', \'in\', \'jobs\', \'garage\', \'via\', \'apple\', \'aapl\'] ",
n2081,3,1,1,   help me reach my goal ,"[\'help\', \'me\', \'reach\', \'my\', \'goal\'] ",
n2082,5,1,0.6631, special education staff working hard on behalf of our students with disabilities  ed1426 ,"[\'special\', \'education\', \'staff\', \'working\', \'hard\', \'on\', \'behalf\', \'of\', \'our\', \'students\', \'with\', \'disabilities\', \'ed1426\'] ",
n2083,1,0,1,"dear  all i want for xmas is for ios 8 to stop crashing my ipad   signed, cindy lou who of whoville  apple","[\'dear\', \'all\', \'i\', \'want\', \'for\', \'xmas\', \'is\', \'for\', \'ios\', \'8\', \'to\', \'stop\', \'crashing\', \'my\', \'ipad\', \'signed\', \'cindy\', \'lou\', \'who\', \'of\', \'whoville\', \'apple\'] ",
n2084,3,1,1," was fighting a never ending battle against hackers of  itunes, says chief eddy cue in  antitrust trial ","[\'was\', \'fighting\', \'a\', \'never\', \'ending\', \'battle\', \'against\', \'hackers\', \'of\', \'itunes\', \'says\', \'chief\', \'eddy\', \'cue\', \'in\', \'antitrust\', \'trial\'] ",
n2085,3,1,0.681,"rt  studio at 45,000 ft   one outlet,  4 computers    we need the batteries of the future now!!!! ","[\'rt\', \'studio\', \'at\', \'45\', \'000\', \'ft\', \'one\', \'outlet\', \'4\', \'computers\', \'we\', \'need\', \'the\', \'batteries\', \'of\', \'the\', \'future\', \'now\'] ",
n2086,3,1,0.9198,td bank aiming to launch apple pay support in mid december  ios blog    aapl,"[\'td\', \'bank\', \'aiming\', \'to\', \'launch\', \'apple\', \'pay\', \'support\', \'in\', \'mid\', \'december\', \'ios\', \'blog\', \'aapl\'] ",
n2087,1,0,0.532,hey  how can i take u2s album off my phone?,"[\'hey\', \'how\', \'can\', \'i\', \'take\', \'u2s\', \'album\', \'off\', \'my\', \'phone\'] ",
n2088,3,1,0.6851,"barclays raises apple price target by 17  to  140, more here        aapl  barclays  stocks","[\'barclays\', \'raises\', \'apple\', \'price\', \'target\', \'by\', \'17\', \'to\', \'140\', \'more\', \'here\', \'aapl\', \'barclays\', \'stocks\'] ",
n2089,3,1,1,"jmp raises apple price target from  130 to  150, reasons why here     jmp  aapl  stocks  wallstreet","[\'jmp\', \'raises\', \'apple\', \'price\', \'target\', \'from\', \'130\', \'to\', \'150\', \'reasons\', \'why\', \'here\', \'jmp\', \'aapl\', \'stocks\', \'wallstreet\'] ",
n2090,3,1,0.64,apple to support a new franchise of 500 ios stores in india  aapl  aapl \n,"[\'apple\', \'to\', \'support\', \'a\', \'new\', \'franchise\', \'of\', \'500\', \'ios\', \'stores\', \'in\', \'india\', \'aapl\', \'aapl\'] ",
n2091,3,1,1,rt  apple to support a new franchise of 500 ios stores in india  aapl  aapl \n,"[\'rt\', \'apple\', \'to\', \'support\', \'a\', \'new\', \'franchise\', \'of\', \'500\', \'ios\', \'stores\', \'in\', \'india\', \'aapl\', \'aapl\'] ",
n2092,3,1,1,hey  how about you teach your people how to use  pay?,"[\'hey\', \'how\', \'about\', \'you\', \'teach\', \'your\', \'people\', \'how\', \'to\', \'use\', \'pay\'] ",
n2093,1,0,1,apple inc  deleted songs from rival services from ipods   aapl,"[\'apple\', \'inc\', \'deleted\', \'songs\', \'from\', \'rival\', \'services\', \'from\', \'ipods\', \'aapl\'] ",
n2095,5,1,1,so cool!  stores will host free hour of code workshops on dec  11 to promote computer science    tech,"[\'so\', \'cool\', \'stores\', \'will\', \'host\', \'free\', \'hour\', \'of\', \'code\', \'workshops\', \'on\', \'dec\', \'11\', \'to\', \'promote\', \'computer\', \'science\', \'tech\'] ",
n2096,3,1,1,why apple needs china to love the apple watch   aapl  aapl \n,"[\'why\', \'apple\', \'needs\', \'china\', \'to\', \'love\', \'the\', \'apple\', \'watch\', \'aapl\', \'aapl\'] ",
n2097,3,1,1,"42  believe  iphone6 wont be available this christmas, survey says  via   aapl","[\'42\', \'believe\', \'iphone6\', \'wont\', \'be\', \'available\', \'this\', \'christmas\', \'survey\', \'says\', \'via\', \'aapl\'] ",
n2098,5,1,0.6879,9 awesome paid  iphone apps that are free for a limited time (save over  100!)  via   aapl,"[\'9\', \'awesome\', \'paid\', \'iphone\', \'apps\', \'that\', \'are\', \'free\', \'for\', \'a\', \'limited\', \'time\', \'save\', \'over\', \'100\', \'via\', \'aapl\'] ",
n2099,3,1,0.4892, i just wish i could post my  fav  coolclimate  merlots on  using my  flip phone,"[\'i\', \'just\', \'wish\', \'i\', \'could\', \'post\', \'my\', \'fav\', \'coolclimate\', \'merlots\', \'on\', \'using\', \'my\', \'flip\', \'phone\'] ",
n2100,3,1,0.732, aapl 31 traits all great leaders share   ,"[\'aapl\', \'31\', \'traits\', \'all\', \'great\', \'leaders\', \'share\'] ",
n2101,1,0,1, the fact these itunes updates makes it anal to reset play counts sometimes yall do the mosttttt,"[\'the\', \'fact\', \'these\', \'itunes\', \'updates\', \'makes\', \'it\', \'anal\', \'to\', \'reset\', \'play\', \'counts\', \'sometimes\', \'yall\', \'do\', \'the\', \'mosttttt\'] ",
n2102,3,1,1,apple   fibonacci technicals levels   intraday  update    aapl  aapl  \n,"[\'apple\', \'fibonacci\', \'technicals\', \'levels\', \'intraday\', \'update\', \'aapl\', \'aapl\'] ",
